{
  "schema_version": "1.0",
  "measurement_kind": "controlled_baseline",
  "transport": "livekit",
  "run_id": "fast-pcm-controlled-01",
  "profile": "integration-voice",
  "fixture_version": "speech-v2",
  "quantile_method": "hyndman_fan_type_7",
  "clocks": [
    {
      "domain": "server_monotonic",
      "method": "perf_counter_ns",
      "unit": "nanosecond"
    },
    {
      "domain": "client_monotonic",
      "method": "performance_now_and_audio_output_timestamp",
      "unit": "millisecond"
    },
    {
      "domain": "browser_audio_context",
      "method": "confirmed_output_frame_divided_by_sample_rate",
      "unit": "millisecond"
    }
  ],
  "run_counts": {
    "warmup": 5,
    "measured": 100,
    "success": 100,
    "failure": 0,
    "excluded": 0
  },
  "metrics": [
    {
      "name": "utterance_finalized",
      "status": "measured",
      "unit": "millisecond",
      "start_point": "vad_speech_end",
      "end_point": "utterance_finalized",
      "trial_count": 100,
      "success_count": 100,
      "failure_count": 0,
      "missing_count": 0,
      "not_applicable_count": 0,
      "excluded_count": 0,
      "rate_denominator": 100,
      "failure_rate_basis_points": 0,
      "p50": 536.4853535,
      "p95": 602.23138965,
      "not_applicable_reason": null,
      "excluded_outcomes": {},
      "missing_outcomes": {}
    },
    {
      "name": "response_decision",
      "status": "measured",
      "unit": "millisecond",
      "start_point": "vad_speech_end",
      "end_point": "response_decision",
      "trial_count": 100,
      "success_count": 100,
      "failure_count": 0,
      "missing_count": 0,
      "not_applicable_count": 0,
      "excluded_count": 0,
      "rate_denominator": 100,
      "failure_rate_basis_points": 0,
      "p50": 546.7754635,
      "p95": 611.7846849,
      "not_applicable_reason": null,
      "excluded_outcomes": {},
      "missing_outcomes": {}
    },
    {
      "name": "stt_start_latency",
      "status": "measured",
      "unit": "millisecond",
      "start_point": "user_audio_received",
      "end_point": "stt_started",
      "trial_count": 100,
      "success_count": 100,
      "failure_count": 0,
      "missing_count": 0,
      "not_applicable_count": 0,
      "excluded_count": 0,
      "rate_denominator": 100,
      "failure_rate_basis_points": 0,
      "p50": 1113.601427,
      "p95": 1118.29969545,
      "not_applicable_reason": null,
      "excluded_outcomes": {},
      "missing_outcomes": {}
    },
    {
      "name": "stt_processing",
      "status": "measured",
      "unit": "millisecond",
      "start_point": "stt_started",
      "end_point": "stt_completed",
      "trial_count": 100,
      "success_count": 100,
      "failure_count": 0,
      "missing_count": 0,
      "not_applicable_count": 0,
      "excluded_count": 0,
      "rate_denominator": 100,
      "failure_rate_basis_points": 0,
      "p50": 379.9571535,
      "p95": 445.78267255000003,
      "not_applicable_reason": null,
      "excluded_outcomes": {},
      "missing_outcomes": {}
    },
    {
      "name": "llm_start_latency",
      "status": "measured",
      "unit": "millisecond",
      "start_point": "stt_completed",
      "end_point": "llm_started",
      "trial_count": 100,
      "success_count": 100,
      "failure_count": 0,
      "missing_count": 0,
      "not_applicable_count": 0,
      "excluded_count": 0,
      "rate_denominator": 100,
      "failure_rate_basis_points": 0,
      "p50": 15.2358075,
      "p95": 20.050538399999997,
      "not_applicable_reason": null,
      "excluded_outcomes": {},
      "missing_outcomes": {}
    },
    {
      "name": "first_text_latency",
      "status": "measured",
      "unit": "millisecond",
      "start_point": "stt_completed",
      "end_point": "first_text_delta",
      "trial_count": 100,
      "success_count": 100,
      "failure_count": 0,
      "missing_count": 0,
      "not_applicable_count": 0,
      "excluded_count": 0,
      "rate_denominator": 100,
      "failure_rate_basis_points": 0,
      "p50": 367.638873,
      "p95": 381.20112025000003,
      "not_applicable_reason": null,
      "excluded_outcomes": {},
      "missing_outcomes": {}
    },
    {
      "name": "llm_completion",
      "status": "measured",
      "unit": "millisecond",
      "start_point": "llm_started",
      "end_point": "llm_completed",
      "trial_count": 100,
      "success_count": 100,
      "failure_count": 0,
      "missing_count": 0,
      "not_applicable_count": 0,
      "excluded_count": 0,
      "rate_denominator": 100,
      "failure_rate_basis_points": 0,
      "p50": 470.25961800000005,
      "p95": 482.20853635,
      "not_applicable_reason": null,
      "excluded_outcomes": {},
      "missing_outcomes": {}
    },
    {
      "name": "tts_start_latency",
      "status": "measured",
      "unit": "millisecond",
      "start_point": "first_synthesizable_segment",
      "end_point": "tts_started",
      "trial_count": 100,
      "success_count": 100,
      "failure_count": 0,
      "missing_count": 0,
      "not_applicable_count": 0,
      "excluded_count": 0,
      "rate_denominator": 100,
      "failure_rate_basis_points": 0,
      "p50": 16.2038415,
      "p95": 27.269985950000002,
      "not_applicable_reason": null,
      "excluded_outcomes": {},
      "missing_outcomes": {}
    },
    {
      "name": "first_audio_generation",
      "status": "measured",
      "unit": "millisecond",
      "start_point": "first_synthesizable_segment",
      "end_point": "first_audio_generated",
      "trial_count": 100,
      "success_count": 100,
      "failure_count": 0,
      "missing_count": 0,
      "not_applicable_count": 0,
      "excluded_count": 0,
      "rate_denominator": 100,
      "failure_rate_basis_points": 0,
      "p50": 324.41157050000004,
      "p95": 364.90096224999996,
      "not_applicable_reason": null,
      "excluded_outcomes": {},
      "missing_outcomes": {}
    },
    {
      "name": "client_playback_latency",
      "status": "measured",
      "unit": "millisecond",
      "start_point": "client_audio_received",
      "end_point": "first_playback",
      "trial_count": 100,
      "success_count": 100,
      "failure_count": 0,
      "missing_count": 0,
      "not_applicable_count": 0,
      "excluded_count": 0,
      "rate_denominator": 100,
      "failure_rate_basis_points": 0,
      "p50": 100.0,
      "p95": 104.0,
      "not_applicable_reason": null,
      "excluded_outcomes": {},
      "missing_outcomes": {}
    },
    {
      "name": "ttfa",
      "status": "measured",
      "unit": "millisecond",
      "start_point": "fixture_speech_end",
      "end_point": "first_playback",
      "trial_count": 100,
      "success_count": 100,
      "failure_count": 0,
      "missing_count": 0,
      "not_applicable_count": 0,
      "excluded_count": 0,
      "rate_denominator": 100,
      "failure_rate_basis_points": 0,
      "p50": 2120.5999999940395,
      "p95": 2186.72000002265,
      "not_applicable_reason": null,
      "excluded_outcomes": {},
      "missing_outcomes": {}
    },
    {
      "name": "local_playback_stop",
      "status": "missing",
      "unit": "millisecond",
      "start_point": "speech_started",
      "end_point": "local_playback_stopped",
      "trial_count": 100,
      "success_count": 0,
      "failure_count": 0,
      "missing_count": 100,
      "not_applicable_count": 0,
      "excluded_count": 0,
      "rate_denominator": 100,
      "failure_rate_basis_points": 0,
      "p50": null,
      "p95": null,
      "not_applicable_reason": null,
      "excluded_outcomes": {},
      "missing_outcomes": {
        "speech_started_event_missing": 100
      }
    },
    {
      "name": "turn_decision",
      "status": "missing",
      "unit": "millisecond",
      "start_point": "speech_started",
      "end_point": "turn_decision",
      "trial_count": 100,
      "success_count": 0,
      "failure_count": 0,
      "missing_count": 100,
      "not_applicable_count": 0,
      "excluded_count": 0,
      "rate_denominator": 100,
      "failure_rate_basis_points": 0,
      "p50": null,
      "p95": null,
      "not_applicable_reason": null,
      "excluded_outcomes": {},
      "missing_outcomes": {
        "speech_started_event_missing": 100
      }
    },
    {
      "name": "cancel_after_decision",
      "status": "missing",
      "unit": "millisecond",
      "start_point": "take_turn_decision",
      "end_point": "server_cancelled",
      "trial_count": 100,
      "success_count": 0,
      "failure_count": 0,
      "missing_count": 100,
      "not_applicable_count": 0,
      "excluded_count": 0,
      "rate_denominator": 100,
      "failure_rate_basis_points": 0,
      "p50": null,
      "p95": null,
      "not_applicable_reason": null,
      "excluded_outcomes": {},
      "missing_outcomes": {
        "take_turn_decision_event_missing": 100
      }
    },
    {
      "name": "barge_in_cancel_total",
      "status": "missing",
      "unit": "millisecond",
      "start_point": "speech_started",
      "end_point": "server_cancelled",
      "trial_count": 100,
      "success_count": 0,
      "failure_count": 0,
      "missing_count": 100,
      "not_applicable_count": 0,
      "excluded_count": 0,
      "rate_denominator": 100,
      "failure_rate_basis_points": 0,
      "p50": null,
      "p95": null,
      "not_applicable_reason": null,
      "excluded_outcomes": {},
      "missing_outcomes": {
        "speech_started_event_missing": 100
      }
    },
    {
      "name": "vad_leading_boundary",
      "status": "missing",
      "unit": "millisecond",
      "start_point": "fixture_speech_start",
      "end_point": "captured_audio_start",
      "trial_count": 100,
      "success_count": 0,
      "failure_count": 0,
      "missing_count": 100,
      "not_applicable_count": 0,
      "excluded_count": 0,
      "rate_denominator": 100,
      "failure_rate_basis_points": 0,
      "p50": null,
      "p95": null,